{
  "catalogType": "traceability-metric-catalog.v1",
  "catalogVersion": "1.0.0",
  "schemaVersion": "1.0.0",
  "description": "Deterministic source-facts traceability metrics and their bound evidentiary sources.",
  "metrics": [
    {
      "metricId": "traceability.entry.command-root-count.v1",
      "metricVersion": "1",
      "metricLabel": "CLI command roots",
      "section": "entry-point-reachability",
      "claimType": "factual",
      "resultType": "integer",
      "disposition": "METRIC_POINTER_NOT_FOUND",
      "query": { "queryId": "traceability.query.call-graph.command-root-count" },
      "source": {
        "artifactKind": "call-graph",
        "valueMode": "artifact-pointer",
        "pointer": "/summary/commandRootCount"
      }
    },
    {
      "metricId": "traceability.entry.exported-function-root-count.v1",
      "metricVersion": "1",
      "metricLabel": "Exported function roots",
      "section": "entry-point-reachability",
      "claimType": "factual",
      "resultType": "integer",
      "disposition": "METRIC_POINTER_NOT_FOUND",
      "query": { "queryId": "traceability.query.call-graph.exported-function-root-count" },
      "source": {
        "artifactKind": "call-graph",
        "valueMode": "artifact-pointer",
        "pointer": "/summary/exportedFunctionRootCount"
      }
    },
    {
      "metricId": "traceability.entry.total-root-count.v1",
      "metricVersion": "1",
      "metricLabel": "Total entry points",
      "section": "entry-point-reachability",
      "claimType": "factual",
      "resultType": "integer",
      "disposition": "METRIC_POINTER_NOT_FOUND",
      "query": { "queryId": "traceability.query.call-graph.total-root-count" },
      "source": {
        "artifactKind": "call-graph",
        "valueMode": "artifact-pointer",
        "pointer": "/summary/totalRootCount"
      }
    },
    {
      "metricId": "traceability.entry.runtime-callable-count.v1",
      "metricVersion": "1",
      "metricLabel": "Runtime callable functions",
      "section": "entry-point-reachability",
      "claimType": "factual",
      "resultType": "integer",
      "disposition": "METRIC_POINTER_NOT_FOUND",
      "query": { "queryId": "traceability.query.call-graph.runtime-callable-count" },
      "source": {
        "artifactKind": "call-graph",
        "valueMode": "artifact-pointer",
        "pointer": "/summary/runtimeCallableCount"
      }
    },
    {
      "metricId": "traceability.entry.reachable-callable-count.v1",
      "metricVersion": "1",
      "metricLabel": "Reachable from entry points",
      "section": "entry-point-reachability",
      "claimType": "factual",
      "resultType": "integer",
      "disposition": "METRIC_POINTER_NOT_FOUND",
      "query": { "queryId": "traceability.query.call-graph.reachable-callable-count" },
      "source": {
        "artifactKind": "call-graph",
        "valueMode": "artifact-pointer",
        "pointer": "/summary/reachableCallableCount"
      }
    },
    {
      "metricId": "traceability.entry.unreachable-callable-count.v1",
      "metricVersion": "1",
      "metricLabel": "Unreachable (dead code)",
      "section": "entry-point-reachability",
      "claimType": "factual",
      "resultType": "integer",
      "disposition": "METRIC_POINTER_NOT_FOUND",
      "query": { "queryId": "traceability.query.call-graph.unreachable-callable-count" },
      "source": {
        "artifactKind": "call-graph",
        "valueMode": "artifact-pointer",
        "pointer": "/summary/unreachableCallableCount"
      }
    },
    {
      "metricId": "traceability.entry.invocation-edge-count.v1",
      "metricVersion": "1",
      "metricLabel": "Invocation edges",
      "section": "entry-point-reachability",
      "claimType": "factual",
      "resultType": "integer",
      "disposition": "METRIC_POINTER_NOT_FOUND",
      "query": { "queryId": "traceability.query.call-graph.invocation-edge-count" },
      "source": {
        "artifactKind": "call-graph",
        "valueMode": "artifact-pointer",
        "pointer": "/summary/invocationEdgeCount"
      }
    },
    {
      "metricId": "traceability.entry.resolved-invocation-edge-count.v1",
      "metricVersion": "1",
      "metricLabel": "Resolved edges",
      "section": "entry-point-reachability",
      "claimType": "factual",
      "resultType": "integer",
      "disposition": "METRIC_POINTER_NOT_FOUND",
      "query": { "queryId": "traceability.query.call-graph.resolved-invocation-edge-count" },
      "source": {
        "artifactKind": "call-graph",
        "valueMode": "artifact-pointer",
        "pointer": "/summary/resolvedInvocationEdgeCount"
      }
    },
    {
      "metricId": "traceability.entry.ambiguous-invocation-edge-count.v1",
      "metricVersion": "1",
      "metricLabel": "Ambiguous edges",
      "section": "entry-point-reachability",
      "claimType": "factual",
      "resultType": "integer",
      "disposition": "METRIC_POINTER_NOT_FOUND",
      "query": { "queryId": "traceability.query.call-graph.ambiguous-invocation-edge-count" },
      "source": {
        "artifactKind": "call-graph",
        "valueMode": "artifact-pointer",
        "pointer": "/summary/ambiguousInvocationEdgeCount"
      }
    },
    {
      "metricId": "traceability.entry.unresolved-invocation-edge-count.v1",
      "metricVersion": "1",
      "metricLabel": "Unresolved edges",
      "section": "entry-point-reachability",
      "claimType": "factual",
      "resultType": "integer",
      "disposition": "METRIC_POINTER_NOT_FOUND",
      "query": { "queryId": "traceability.query.call-graph.unresolved-invocation-edge-count" },
      "source": {
        "artifactKind": "call-graph",
        "valueMode": "artifact-pointer",
        "pointer": "/summary/unresolvedInvocationEdgeCount"
      }
    },
    {
      "metricId": "traceability.entry.max-depth.v1",
      "metricVersion": "1",
      "metricLabel": "Max call depth",
      "section": "entry-point-reachability",
      "claimType": "factual",
      "resultType": "integer",
      "disposition": "METRIC_POINTER_NOT_FOUND",
      "query": { "queryId": "traceability.query.call-graph.max-depth" },
      "source": {
        "artifactKind": "call-graph",
        "valueMode": "artifact-pointer",
        "pointer": "/summary/maxDepth"
      }
    },
    {
      "metricId": "traceability.symbol.function-count.v1",
      "metricVersion": "1",
      "metricLabel": "Functions",
      "section": "symbol-inventory",
      "claimType": "factual",
      "resultType": "integer",
      "disposition": "METRIC_POINTER_NOT_FOUND",
      "query": { "queryId": "traceability.query.symbol.function-count" },
      "source": {
        "artifactKind": "source-fact-index",
        "valueMode": "symbol-count",
        "symbolKind": "function"
      }
    },
    {
      "metricId": "traceability.symbol.variable-count.v1",
      "metricVersion": "1",
      "metricLabel": "Variables",
      "section": "symbol-inventory",
      "claimType": "factual",
      "resultType": "integer",
      "disposition": "METRIC_POINTER_NOT_FOUND",
      "query": { "queryId": "traceability.query.symbol.variable-count" },
      "source": {
        "artifactKind": "source-fact-index",
        "valueMode": "symbol-count",
        "symbolKind": "variable"
      }
    },
    {
      "metricId": "traceability.symbol.parameter-count.v1",
      "metricVersion": "1",
      "metricLabel": "Parameters",
      "section": "symbol-inventory",
      "claimType": "factual",
      "resultType": "integer",
      "disposition": "METRIC_POINTER_NOT_FOUND",
      "query": { "queryId": "traceability.query.symbol.parameter-count" },
      "source": {
        "artifactKind": "source-fact-index",
        "valueMode": "symbol-count",
        "symbolKind": "parameter"
      }
    },
    {
      "metricId": "traceability.symbol.class-count.v1",
      "metricVersion": "1",
      "metricLabel": "Classes",
      "section": "symbol-inventory",
      "claimType": "factual",
      "resultType": "integer",
      "disposition": "METRIC_POINTER_NOT_FOUND",
      "query": { "queryId": "traceability.query.symbol.class-count" },
      "source": {
        "artifactKind": "source-fact-index",
        "valueMode": "symbol-count",
        "symbolKind": "class"
      }
    },
    {
      "metricId": "traceability.symbol.total-count.v1",
      "metricVersion": "1",
      "metricLabel": "Total",
      "section": "symbol-inventory",
      "claimType": "factual",
      "resultType": "integer",
      "disposition": "METRIC_POINTER_NOT_FOUND",
      "query": { "queryId": "traceability.query.symbol.total-count" },
      "source": {
        "artifactKind": "source-fact-index",
        "valueMode": "sum-symbol-counts",
        "symbolKinds": [
          "function",
          "variable",
          "parameter",
          "class"
        ]
      }
    },
    {
      "metricId": "traceability.feature.canonical-feature-count.v1",
      "metricVersion": "1",
      "metricLabel": "Canonical features",
      "section": "feature-coverage",
      "claimType": "factual",
      "resultType": "integer",
      "disposition": "METRIC_POINTER_NOT_FOUND",
      "query": { "queryId": "traceability.query.feature.canonical-feature-count" },
      "source": {
        "artifactKind": "governance-report",
        "valueMode": "artifact-pointer",
        "pointer": "/featureCoverage/summary/canonicalFeatures"
      }
    },
    {
      "metricId": "traceability.feature.proposed-feature-count.v1",
      "metricVersion": "1",
      "metricLabel": "Proposed features",
      "section": "feature-coverage",
      "claimType": "factual",
      "resultType": "integer",
      "disposition": "METRIC_POINTER_NOT_FOUND",
      "query": { "queryId": "traceability.query.feature.proposed-feature-count" },
      "source": {
        "artifactKind": "governance-report",
        "valueMode": "artifact-pointer",
        "pointer": "/featureCoverage/summary/proposedFeatures"
      }
    },
    {